{"bodyMarkdown":"## Sentetik başlık\n**Güvenli** yerel metin.\n- Liste\n<script>alert(1)</script>","contentHash":"5ff2e19e2b54c15aa3e390adfd1f2f3a67c20ff865f058474aba6421bebc1e50","headline":"Sentetik staging haberi 2","language":"tr","primaryCategory":"Enerji","publicationStatus":"PUBLISHED","publishedAt":"2026-10-07T08:00:00Z","retractedAt":null,"revisionId":"00000000-0000-0000-0000-000000000201","revisionNumber":1,"revisionType":"INITIAL","schemaVersion":1,"slug":"sentetik-2","sources":[{"publishedAt":"2026-10-07T07:00:00Z","role":"PRIMARY","sourceName":"Sentetik Kaynak","title":"Sentetik kaynak başlığı","url":"https://example.test/source-2"}],"standfirst":"Yalnız yerel test içeriği.","storyId":"00000000-0000-0000-0000-000000000002","updatedAt":"2026-10-07T08:00:00Z"}
