{"bodyMarkdown":"EPDK, kasım ayı spot boru gazı ithalatına ilişkin kapasite ürünleri için talep çağrısı metnini yayımladı.\n\nKapasite dağıtımına yönelik talep toplama ve/veya yarışmanın 23 Ekim 2026’da elektronik platform üzerinden düzenlenmesi planlanıyor.\n\nTalep çağrısı metni ile uygulama esasları kurumun duyurusuna eklenmiş durumda.","contentHash":"e2093cfafe13927d74e1acdc0cee1cfcbd82606da90952193caf63b8aae761e2","headline":"Kasım ayı spot gaz kapasitesi için talep toplama 23 Ekim’de","language":"tr","primaryCategory":"enerji-piyasalari","publicationStatus":"PUBLISHED","publishedAt":"2026-10-20T09:54:41.461723Z","retractedAt":null,"revisionId":"7a7f9664-28f8-4729-bb1f-ca36cf430d6a","revisionNumber":1,"revisionType":"INITIAL","schemaVersion":1,"slug":"kasim-ayi-spot-gaz-kapasitesi-icin-talep-toplama-23-ekimde","sources":[{"publishedAt":null,"role":"PRIMARY","sourceName":"Enerji Piyasası Düzenleme Kurumu (EPDK)","title":"Kasım ayı spot gaz kapasitesi için talep toplama 23 Ekim’de","url":"https://www.epdk.gov.tr/Detay/Icerik/4-16459/spot-boru-gazi-ithalatina-konu-edilecek-olan-2026"}],"standfirst":null,"storyId":"feb0bc8b-9e9b-4c98-b49d-8d155e4d205e","updatedAt":"2026-10-20T09:54:41.461723Z"}
