{"bodyMarkdown":"COP31, 9-20 Kasım’da Antalya’da düzenlenecek. Türkiye’de düzenlenecek Birleşmiş Milletler (BM) İklim Değişikliği Çerçeve Sözleşmesi 31. Taraflar Konferansı (COP31) bu tarihlerde gerçekleşecek. \"Ortak evimiz dünya için Antalya'da buluşuyoruz\" ifadeleri konferansı tanıtan pankartlarda yer aldı.\n\nÇevre, Şehircilik ve İklim Değişikliği Bakanı Murat Kurum, futbol federasyonu ve kulüplere teşekkür ederek \"COP31 için hep birlikte sahadayız\" şeklinde bir paylaşım yaptı. Süper Lig’in 9. haftasında Antalya’da gerçekleştirilen iklim zirvesi, COP31’e destek veren futbol federasyonu ve kulüplere de teşekkür içeriydi.","contentHash":"dbb8cdbf4497f84ecdc5561094e17b6ea860e10ca9df78acb82d82df2d4c7419","headline":"COP31, 9-20 Kasım’da Antalya’da Gerçekleşecek","language":"tr","primaryCategory":"iklim","publicationStatus":"PUBLISHED","publishedAt":"2026-10-27T08:01:35.067975Z","retractedAt":null,"revisionId":"500cb788-e066-492f-8e95-8e7be0c4d7b4","revisionNumber":1,"revisionType":"INITIAL","schemaVersion":1,"slug":"cop31-9-20-kasimda-antalyada-gerceklesecek","sources":[{"publishedAt":null,"role":"PRIMARY","sourceName":"Çevre Bakanlığı","title":"BAKAN KURUM: COP31 İÇİN HEP BİRLİKTE SAHADAYIZ","url":"https://csb.gov.tr/haberler/bakan-kurum-cop31-icin-hep-birlikte-sahadayiz-307106"}],"standfirst":"Birleşmiş Milletler İklim Değişikliği Çerçeve Sözleşmesi 31. Taraflar Konferansı (COP31) 9-20 Kasım tarihleri arasında Antalya’da düzenlenecek. Etkinlik, sporun birleştirici gücüyle destekleniyor.","storyId":"76226bd7-7196-4871-bd62-16389d3ef0b7","updatedAt":"2026-10-27T08:01:35.067975Z"}
