{"bodyMarkdown":"EPDK, 2027 yılında YEKDEM'den yararlanmak isteyen üretim lisansı sahibi tüzel kişilerin başvurularını 30 Kasım 2026 tarihi sonuna kadar alacağını duyurdu. Başvurular yalnızca elektronik ortamda kabul edilecek; elden veya posta yoluyla yapılan başvurular dikkate alınmayacak.\n\nTüzel kişiler, YEKDEM başvurularını muhatap yetkilisi veya lisans yetkilisi olarak yetkilendirdikleri gerçek kişiler aracılığıyla yapabilecek. Muhatap yetkilisi bulunmayan şirketlerin, yetki belgesinin aslını veya noter onaylı nüshasını Kuruma elden ya da posta ile ivedilikle sunması gerekiyor. Başvuru dilekçesinin yetkili kişi tarafından elektronik ortamda imzalanması zorunlu; imzalanmayan başvurular geçerli sayılmayacak.\n\nYEKDEM başvurusuna konu üretim tesislerinin 1 Kasım 2016 tarihi ve sonrasında işletmeye girmiş olması ve başvuru tarihi itibarıyla geçici kabulü yapılarak tamamen ya da kısmen işletmeye alınmış olması gerekiyor. Geçici kabul tutanaklarının kapak sayfası ve mahallin en büyük mülki amirine sunulan nüshası başvuru esnasında sisteme yüklenmeli.\n\nEPDK, YEKDEM başvurularında herhangi bir dosya kontrolü ve eksiklik bildirimi yapmayacak. Yalnızca tam ve eksiksiz olduğu tespit edilen başvurular değerlendirmeye alınacak. Başvuruyu sonlandırmak isteyenlerin talebini 30 Kasım 2026 tarihine kadar yazılı olarak Kuruma iletmesi gerekiyor.","contentHash":"04398c0f747c014561333cae19ca62ea43d1d7344dbd98ac875269f2feb586fe","headline":"EPDK, 2027 YEKDEM başvuruları için 30 Kasım 2026 tarihine kadar süre tanıdı","language":"tr","primaryCategory":"enerji-piyasalari","publicationStatus":"PUBLISHED","publishedAt":"2026-10-20T12:01:50.172283Z","retractedAt":null,"revisionId":"9141a130-0c90-4d12-a040-6a377091952d","revisionNumber":1,"revisionType":"INITIAL","schemaVersion":1,"slug":"epdk-2027-yekdem-basvurulari-icin-30-kasim-2026-tarihine-kadar-sure-tanidi","sources":[{"publishedAt":null,"role":"PRIMARY","sourceName":"Enerji Piyasası Düzenleme Kurumu (EPDK)","title":"2027 yılı YEKDEM Başvurularının Alınması Hakkında","url":"https://www.epdk.gov.tr/Detay/Icerik/4-16464/2027-yili-yekdem-basvurularinin-alinmasi-hakkinda"}],"standfirst":"Başvurular yalnızca elektronik ortamda alınacak; imzalanmayan dilekçeler geçerli sayılmayacak. Tesislerin 1 Kasım 2016 ve sonrasında işletmeye girmiş olması gerekiyor.","storyId":"bf0559af-22fa-42b3-a198-26d83e728e6f","updatedAt":"2026-10-20T12:01:50.172283Z"}
