{"bodyMarkdown":"Petkim, Master Plan projesi kapsamında dünyanın önde gelen teknoloji firmalarıyla yeni etilen, polipropilen ve polietilen fabrikaları için lisans ve mühendislik çalışmalarına başladı. FEED çalışmaları resmi olarak başlatıldı.\n\nProje kapsamında Technip Energies, Univation Technologies ve Lummus Novolen Technology ile sırasıyla MFSC, polietilen ve polipropilen üniteleri için lisans ve mühendislik sözleşmeleri imzalandı.\n\nFEED aşamasının tamamlanmasının ardından nihai yatırım kararı alınırsa, Petkim'in yıllık etilen kapasitesi 588 bin tondan 1,2 milyon tona, polipropilen kapasitesi 145 bin tondan 550 bin tona çıkarılması planlanıyor; bu da toplam polimer üretiminin mevcut seviyesinin iki katının üzerine çıkmasını sağlayacak.\n\nFEED çalışmalarına 70 milyon dolar kaynak ayrıldı ve çalışmaların 2027 yılı sonuna kadar tamamlanması, olası nihai yatırım kararına temel oluşturması hedefleniyor.","contentHash":"f387201d8ef5d5f9e427004477bd7a4ef24b13f49c743767fae4b62e2612fff1","headline":"Petkim, yeni etilen, polipropilen ve polietilen tesisleri için lisans ve mühendislik çalışmalarını başlattı","language":"tr","primaryCategory":"enerji","publicationStatus":"PUBLISHED","publishedAt":"2026-10-20T13:47:45.618151Z","retractedAt":null,"revisionId":"f092d5d8-361f-41e6-a107-f645c679dda6","revisionNumber":1,"revisionType":"INITIAL","schemaVersion":1,"slug":"petkim-yeni-etilen-polipropilen-ve-polietilen-tesisleri-icin-lisans-ve","sources":[{"publishedAt":null,"role":"PRIMARY","sourceName":"Petkim (şirket açıklaması)","title":"Petkim, Master Plan projesi kapsamında dünyanın önde gelen teknoloji firmalarıyla yeni etilen, polipropilen ve polietilen fabrikaları için lisans ve mühendislik çalışmalarına başladı","url":"https://petkim.com.tr/basin-bultenleri/petkim-master-plan-projesi-kapsaminda-dunyanin-onde-gelen-teknoloji-firmalariyla-yeni-etilen-polipropilen-ve-polietilen-fabrikalari-icin-lisans-ve-muhendislik-calismalarina-basladi"}],"standfirst":"Petkim, Master Plan projesi kapsamında FEED çalışmalarını resmen başlattı, 70 milyon USD kaynak ayırdı ve önde gelen teknoloji firmalarıyla lisans sözleşmeleri imzalayarak kapasite artırma hedeflerini duyurdu.","storyId":"411b4d3b-4d69-4164-b066-b576f421399e","updatedAt":"2026-10-20T13:47:45.618151Z"}
