{"bodyMarkdown":"Fortune Dergisi'nin Türkiye'nin en büyük şirketlerini sıraladığı Fortune 500 Türkiye 2025 listesinde 7. sırada yer almanın gururunu yaşıyoruz.\n\nÜlke geneline ve yakın coğrafyaya kara, hava ve deniz araçlarında ihtiyaç duyulan tüm yakıt çeşitlerini sağlayabilen Türkiye'nin lider enerji altyapı grubu olarak, 2.500'den fazla istasyonumuzla ülkemizin en geniş akaryakıt ağını yönetiyoruz.\n\n85 yıllık köklü geçmişimizden aldığımız gücümüzle; ekonomimize, topluma ve değer zincirimize katkı sağlıyoruz.","contentHash":"3e1a80a73d22eb1695d8660e84834f37ed4ec43afe190d13c2f6b430c4310067","headline":"Petrol Ofisi, Fortune 500 Türkiye 2025 listesinde 7. sırada","language":"tr","primaryCategory":"enerji-piyasalari","publicationStatus":"PUBLISHED","publishedAt":"2026-10-21T14:23:08.253286Z","retractedAt":null,"revisionId":"c1f455f0-2c5e-4922-80ff-372e68a1c67f","revisionNumber":1,"revisionType":"INITIAL","schemaVersion":1,"slug":"petrol-ofisi-fortune-500-turkiye-2025-listesinde-7-sirada","sources":[{"publishedAt":null,"role":"PRIMARY","sourceName":"Petrol Ofisi (LinkedIn paylaşımı)","title":"Fortune Dergisi’nin Türkiye’nin en büyük şirketlerini sıraladığı Fortune 500 Türkiye 2025 listesinde 7. sırada yer almanın gururunu yaşıyoruz.","url":"https://www.linkedin.com/posts/petrol-ofisi_petrolofisigrubu-activity-7513981366628372482-sElu"}],"standfirst":"Fortune Dergisi'nin hazırladığı 2025 listesinde 7. sırada yer alan Petrol Ofisi, 2.500'den fazla istasyonuyla ülkenin en geniş akaryakıt ağını yönettiğini vurguladı.","storyId":"e342ed82-1fb9-43cd-8659-0f40c1426fcc","updatedAt":"2026-10-21T14:23:08.253286Z"}
