{"bodyMarkdown":"Türkiye'nin elektrik kurulu gücü, 2026 yılı Eylül ayı sonu itibarıyla 127 bin 355 megavata ulaştı.\n\nYenilenebilir kaynaklı kurulu güç aynı dönemde 80 bin 315 megavata çıkarak toplam kurulu gücün yüzde 63,1'ini oluşturdu.\n\nGüneş ve rüzgâr enerjisinin toplam kurulu gücü 43 bin 762 megavata çıkarken, bu iki kaynağın toplam kurulu güç içindeki payı yüzde 34,4'e yükseldi.\n\nEylül ayında aylık elektrik üretimi 31,79 milyar kilovatsaat olarak kayıtlara geçti.\n\nEylülde yerli kaynaklardan 22,35 milyar kilovatsaat elektrik üretildi; bu, toplam üretimin yüzde 70,3'ü oldu.","contentHash":"e1c95f973743603676fd563f9af81eb2bf5ef363f790e28949e2c0bc29763fb0","headline":"Türkiye'nin elektrik kurulu gücü Eylül sonunda 127.355 MW’a ulaştı","language":"tr","primaryCategory":"enerji","publicationStatus":"PUBLISHED","publishedAt":"2026-10-26T13:00:26.874555Z","retractedAt":null,"revisionId":"020d4041-1d4f-49fd-96cc-fca657c89615","revisionNumber":2,"revisionType":"CORRECTION","schemaVersion":1,"slug":"turkiyenin-elektrik-kurulu-gucu-eylul-sonunda-127355-mwa-ulasti","sources":[{"publishedAt":null,"role":"PRIMARY","sourceName":"Enerji Bakanlığı","title":"Türkiye’nin Elektrik Kurulu Gücü 127 Bin 355 Megavata Ulaştı","url":"https://enerji.gov.tr/haber-detay?id=31953"}],"standfirst":"Enerji ve Tabii Kaynaklar Bakanlığı verilerine göre, 2026 yılı Eylül ayı sonu itibarıyla toplam kurulu kapasite 127.355 MW, yenilenebilir kaynaklı kapasite 80.315 MW ve güneş‑rüzgâr ortak gücü 43.762 MW olarak gerçekleşti. Aynı dönemde aylık elektrik üretimi 31,79 TWh olup, üretimin %70,3’ü yerli kaynaklarla sağlandı.","storyId":"665ca7be-7326-4bb5-914a-a1e8524267cf","updatedAt":"2026-10-26T13:10:40.128464Z"}
