{"bodyMarkdown":"Enerji Piyasası Düzenleme Kurumu (EPDK), 9/5/2021 tarihli ve 31479 sayılı Resmi Gazete'de yayımlanan Elektrik Piyasasında Depolama Faaliyetleri Yönetmeliği'nin 6. maddesinin birinci fıkrasını değiştirdi.\n\nDeğişiklikle, tüketiciler, ilgili şebeke işletmecisinin uygun bağlantı görüşü vermesi ve aynı ölçüm noktasında bulunması şartıyla elektrik depolama tesisi kurabilir.\n\nAncak, tüketicilerin anlaşma gücünden daha yüksek kurulu güçte depolama tesisi kurmak istemesi durumunda, 28/1/2014 tarihli ve 28896 sayılı Resmi Gazete'de yayımlanan Elektrik Piyasası Bağlantı ve Sistem Kullanım Yönetmeliği'nin 14. maddesinde belirtilen ünite ve sistemleri kurmak zorunludur.\n\nYönetmeliğin yürürlüğe girdiği tarih aynı zamanda yürütme sorumluluğunu EPDK Başkanı'na bıraktı.","contentHash":"432c1ddd8a6adeb6f50f0ee343ec0fb675a10995cdd73b3148e525b8e670c38f","headline":"EPDK, tüketicilerin aynı ölçüm noktasında depolama tesisi kurmasını mümkün kıldı","language":"tr","primaryCategory":"enerji","publicationStatus":"PUBLISHED","publishedAt":"2026-10-22T13:48:08.231323Z","retractedAt":null,"revisionId":"9f70c955-44d7-41ec-9e88-02ca208e00b2","revisionNumber":1,"revisionType":"INITIAL","schemaVersion":1,"slug":"epdk-tuketicilerin-ayni-olcum-noktasinda-depolama-tesisi-kurmasini-mumkun-kildi","sources":[{"publishedAt":null,"role":"PRIMARY","sourceName":"Resmî Gazete","title":"Elektrik Piyasasında Depolama Faaliyetleri Yönetmeliğinde Değişiklik Yapılmasına Dair Yönetmelik","url":"https://www.resmigazete.gov.tr/eskiler/2026/10/20261019-5.htm"}],"standfirst":"Elektrik Piyasasında Depolama Faaliyetleri Yönetmeliği'nde yapılan değişiklikle, şebeke işletmecisinin uygun bağlantı görüşü vermesi koşuluyla tüketiciler aynı ölçüm noktasında depolama tesisi kurabilecek.","storyId":"70ed99a0-b412-44e2-97ae-ef046b87a563","updatedAt":"2026-10-22T13:48:08.231323Z"}
