{"bodyMarkdown":"İklim Değişikliği Başkanı Prof. Dr. Halil Hasar, Uşak’da gerçekleştirilen ‘Karbon Ekonomisi ve Sürdürülebilir Enerji Politikaları Çalıştayı’nda, mevcut politikalar sürdürüldüğü takdirde dünyanın bu yüzyılın sonunda 3 santigrat derece ısı artışı görebileceği uyarısında bulundu.\n\nHasar, COP31’in üç temel mottosunun ‘Diyalog, Uzlaşı ve Aksiyon’ olduğunu ve bu çerçevede tüm ülkelerin en iyi müzakerecilerini göndererek bilim, teknoloji ve finansın kritik rolüne dikkat çekti.\n\nTürkiye, COP31 kapsamında 2035’e kadar elektrifikasyon oranını yüzde 35’e yükseltme hedefi koydu; şu an dünya genelinde bu oran yüzde 20‑24 seviyelerinde iken Türkiye’de yüzde 22 seviyesinde bulunuyor.","contentHash":"9f831fd4157b95d6f038033392d36d52a0896960179728002b38f28b5e537f92","headline":"İklim Değişikliği Başkanı Hasar, mevcut politikaların devamı halinde 3°C artış riski ve COP31 hedeflerini vurguladı","language":"tr","primaryCategory":"iklim","publicationStatus":"PUBLISHED","publishedAt":"2026-10-22T13:48:07.700916Z","retractedAt":null,"revisionId":"255d0415-ef84-4fb7-af9b-50579503bf41","revisionNumber":1,"revisionType":"INITIAL","schemaVersion":1,"slug":"iklim-degisikligi-baskani-hasar-mevcut-politikalarin-devami-halinde-3-c-artis","sources":[{"publishedAt":null,"role":"PRIMARY","sourceName":"İklim Değişikliği Başkanlığı","title":"İklim Değişikliği Başkanı Hasar’dan Önemli Uyarı","url":"https://iklim.gov.tr/iklim-degisikligi-baskani-hasar-dan-onemli-uyari-haber-6024"}],"standfirst":"Hasar, Uşak'ta düzenlenen çalıştayda dünya genelinde iklim belirsizliklerinin normalleşeceğini ve 3 santigrat derecelik ısı artışının mümkün olduğunu, COP31'in üç mottosunu ve Türkiye'nin 2035 yılına kadar elektrifikasyon hedefini açıkladı.","storyId":"601dd296-1130-4ee7-bc05-d8c6c23684a4","updatedAt":"2026-10-22T13:48:07.700916Z"}
