{"bodyMarkdown":"Kanada Başbakanı Mark Carney’in Ankara ziyareti kapsamında, Enerji ve Tabii Kaynaklar Bakanı Alparslan Bayraktar ile Kanada Enerji ve Doğal Kaynaklar Bakanı Tim Hodgson, iki ülkenin enerji alanındaki ortak bildiriyi imzaladılar. Bildiride nükleer teknoloji, LNG tedariki, yenilenebilir enerji ve madencilik konularında iş birliğinin geliştirilmesi kararlaştırıldı.\n\nBakan Bayraktar, görüşmelerde Kanada’nın CANDU reaktör teknolojisinin Türkiye’de uygulanabilirliğini değerlendirecek teknik iş birliğine odaklanıldığını belirtti.\n\nOrtak bildiride, Kanada’nın artan LNG ihracat kapasitesinden yararlanmak amacıyla Kanadalı LNG proje geliştiricileri ile uzun vadeli alıcılar arasındaki görüşmelerin kolaylaştırılmasına karar verildi.\n\nBakan Bayraktar, sosyal medya paylaşımında bu bildirinin nükleer enerji, LNG tedariki, yenilenebilir enerji ve madencilik alanlarında kapsamlı bir çerçeve oluşturduğunu ve iki ülkenin karşılıklı fayda sağlayacak somut çalışmalara yönelmesini hedeflediğini vurguladı.","contentHash":"ee58ad19a19c8f4060356261897384b092c808f711cf76c39fcda27334478993","headline":"Kanada‑Türkiye Enerji İş Birliği Anlaşması İmzalandı","language":"tr","primaryCategory":"enerji-piyasalari","publicationStatus":"PUBLISHED","publishedAt":"2026-10-27T08:59:08.783402Z","retractedAt":null,"revisionId":"e6bd042d-2cc9-4b2d-a098-0936deb8aa5e","revisionNumber":1,"revisionType":"INITIAL","schemaVersion":1,"slug":"kanada-turkiye-enerji-is-birligi-anlasmasi-imzalandi","sources":[{"publishedAt":null,"role":"PRIMARY","sourceName":"Enerji Bakanlığı","title":"Kanada ile Enerjide İş Birliği","url":"https://enerji.gov.tr/haber-detay?id=31951"}],"standfirst":"Kanada Başbakanı Mark Carney ve Türkiye Enerji ve Tabii Kaynaklar Bakanı Alparslan Bayraktar, Ankara’da imzaladıkları ortak bildiride nükleer enerji, LNG tedariki, yenilenebilir enerji ve madencilik alanlarında kapsamlı bir iş birliği çerçevesi oluşturduklarını duyurdular.","storyId":"cc8c4289-a005-4702-82ab-20018e8f3048","updatedAt":"2026-10-27T08:59:08.783402Z"}
