{"bodyMarkdown":"Osman Gazi, 17 Ekim 2026 tarihinde Filyos Türkiye Petrolleri Limanı'nda düzenlenen törenle Karadeniz'deki görev yerine uğurlandı. Platform, 2025 Mayıs ayı sonunda Filyos Limanı'nda yürütülen hazırlık, modernizasyon ve entegrasyon çalışmalarının tamamlanmasının ardından yola çıktı.\n\nPlatform, 298,5 metre uzunluğa, 56 metre genişliğe ve 140 kişilik personel kapasitesine sahiptir; üstyapısında Sakarya Gaz Sahası’nın ihtiyaçlarına göre 21 ayrı tesis bulunmaktadır.\n\nOsman Gazi, Karadeniz'de kıyıdan yaklaşık 170 kilometre açıkta konumlandırılacak ve 20 yıl boyunca Sakarya Gaz Sahası'ndaki kuyulardan elde edilen doğal gazı işleyerek deniz altı boru hatları aracılığıyla Filyos'a ulaştıracaktır.\n\nPlatformun devreye alınmasıyla Sakarya Gaz Sahası'ndaki günlük doğal gaz üretim kapasitesi 20 milyon metreküpe çıkarılacak ve yaklaşık 8 milyon hanenin doğal gaz ihtiyacı yerli kaynaklarla karşılanacaktır.","contentHash":"4c8787f692e7ee8d7603bd14e3043475e63ba63032704687ab117ef487ea8c7d","headline":"Osman Gazi Yüzer Üretim Platformu Karadeniz’de Görevine Başladı","language":"tr","primaryCategory":"enerji-piyasalari","publicationStatus":"PUBLISHED","publishedAt":"2026-10-26T12:36:18.957495Z","retractedAt":null,"revisionId":"0fd112c7-a206-4cb1-8ee9-67dbdd63f2d3","revisionNumber":1,"revisionType":"INITIAL","schemaVersion":1,"slug":"osman-gazi-yuzer-uretim-platformu-karadenizde-gorevine-basladi","sources":[{"publishedAt":null,"role":"PRIMARY","sourceName":"TPAO","title":"Osman Gazi Karadeniz'deki Görev Yerine Uğurlandı","url":"https://www.tpao.gov.tr/haberler/osman-gazi-karadenizdeki-gorev-yerine-ugurlandi"}],"standfirst":"Türkiye'nin ilk yüzer üretim platformu Osman Gazi, 17 Ekim 2026 tarihinde Filyos Limanı'nda düzenlenen törenle Karadeniz'e gönderildi; 298,5 m uzunluğunda, 56 m genişliğinde ve 140 kişilik personel kapasitesine sahip platform, 170 km açıkta 20 yıl boyunca Sakarya Gaz Sahası'ndan doğal gaz üretip Filyos'a taşıyacak.","storyId":"3731928e-c9ac-4d93-b1ab-1c7cd5410906","updatedAt":"2026-10-26T12:36:18.957495Z"}
