{"bodyMarkdown":"Türkiye’de ticari şarj hizmeti verilen soket sayısı eylül sonunda 48.971’e ulaştı. Ağustosta bu sayı 47.908’di. EPDK’nin 16 Ekim’de yayımladığı eylül raporuna göre, soketlerin 27.664’ü alternatif akımla (AC), 21.307’si doğru akımla (DC) çalışıyor.\n\nRaporda TÜİK kaynak gösterilerek verilen elektrikli araç sayısı da ağustostaki 476.934’ten eylülde 491.492’ye yükseldi. Şarj istasyonlarının toplam kurulu gücü aynı dönemde 3.773 megavattan 3.875 megavata çıktı.\n\nAynı dönemde ticari şarj hizmeti kapsamındaki elektrik tüketimi ağustostaki 97.469 megavatsaatten eylülde 83.253 megavatsaate geriledi. Raporda bu düşüşün nedeni açıklanmıyor.\n\nEylüldeki tüketimin yüzde 22,27’si Trugo, yüzde 16,68’i Zes istasyonlarında gerçekleşti. Eşarj’ın payı yüzde 6,13, Wat Mobilite’nin yüzde 4,76, Astor’un yüzde 4,40 oldu. Bu oranlar elektrik tüketimini gösteriyor; şirketlerin gelir veya soket sayısı içindeki paylarıyla aynı ölçüt değil.\n\nVeriler, Şarj Hizmeti Yönetmeliği kapsamında ticari faaliyet yürütülen soketleri kapsıyor. Evlerdeki tüm özel şarj noktalarının sayısı veya tüketimi olarak değerlendirilmemeli.","contentHash":"1c68383a8f1e8a72c6c3a810ae79b234ac40bbb9f2bb0798eaed5dbdda8014c8","headline":"Türkiye’de şarj soketi sayısı eylülde 48.971’e çıktı","language":"tr","primaryCategory":"enerji-piyasalari","publicationStatus":"PUBLISHED","publishedAt":"2026-10-19T12:37:31.134506Z","retractedAt":null,"revisionId":"941610c1-14ad-47ae-8652-3915fb3b819a","revisionNumber":1,"revisionType":"INITIAL","schemaVersion":1,"slug":"turkiye-de-sarj-soketi-sayisi-eylulde-48-971-e-cikti","sources":[{"publishedAt":null,"role":"PRIMARY","sourceName":"Enerji Piyasası Düzenleme Kurumu (EPDK)","title":"Türkiye’de şarj soketi sayısı eylülde 48.971’e çıktı","url":"https://www.epdk.gov.tr/Detay/Icerik/4-16463/sarj-hizmeti-piyasasi-aylik-istatistikleri-eylul-"}],"standfirst":"Ağustosa göre soket sayısı 1.063 artarken, şarj istasyonlarındaki elektrik tüketimi azaldı. Tüketimde en yüksek pay Trugo ve Zes’in oldu.","storyId":"81950f02-de0e-44a0-9f6f-613fc67474c1","updatedAt":"2026-10-19T12:37:31.134506Z"}
