{"bodyMarkdown":"Bakan Bayraktar, “Milli Enerji 2040 kapsamında elektrik iletim ve dağıtım altyapımızda yaklaşık 100 milyar dolarlık yatırım öngörüyoruz.” ifadeleriyle, şebekenin modernizasyonu için büyük bir mali taahhüt açıklamıştı.\n\nEnerji dönüşümünün bir parçası olarak, ülkenin nihai enerji tüketiminde elektriğin payı 2002‑de %15 iken bugün %21’e yükselmiş, sanayide %30, binalarda %33 seviyelerine ulaşmıştır.\n\nBakan, yeni dağıtım şebekesinde yerli yazılımların yaygınlaştırılmasını ve siber saldırılara karşı dayanıklı hâle getirilmesini hedeflediklerini belirtti.","contentHash":"63bf8485bece236fdb073b132290c60be3d236f3a57b8e8a2ed9570f21cbc12c","headline":"Milli Enerji 2040 kapsamında iletim ve dağıtım altyapısına yaklaşık 100 milyar dolar yatırım planlandı","language":"tr","primaryCategory":"enerji","publicationStatus":"PUBLISHED","publishedAt":"2026-10-27T13:09:50.259450Z","retractedAt":null,"revisionId":"d7daf567-2885-4376-89dc-90c4ffd3a09c","revisionNumber":1,"revisionType":"INITIAL","schemaVersion":1,"slug":"milli-enerji-2040-kapsaminda-iletim-ve-dagitim-altyapisina-yaklasik-100-milyar","sources":[{"publishedAt":null,"role":"PRIMARY","sourceName":"Enerji Bakanlığı","title":"Milli Enerji 2040 Lansmanı 5 Kasım’da İstanbul’da","url":"https://enerji.gov.tr/haber-detay?id=31954"}],"standfirst":"Enerji ve Tabii Kaynaklar Bakanı Alparslan Bayraktar, 5 Kasım’da İstanbul’da düzenlenecek lansmanda, Türkiye’nin elektrik şebekesini güçlendirmek ve dijitalleştirmek amacıyla yaklaşık 100 milyar dolar tutarında bir yatırım öngördüklerini duyurdu.","storyId":"f58e5b56-8b90-46f1-91dd-7376fcbd1792","updatedAt":"2026-10-27T13:09:50.259450Z"}
