{"bodyMarkdown":"Cheniere Energy, Corpus Christi LNG terminalindeki üçüncü aşama genişletme projesini 28 Ağustos 2026’da tamamladı. \nYedi sıvılaştırma hattından oluşan proje, Aralık 2024’te üretime başlamıştı.\n\nGenişlemeyle terminalin nominal kapasitesi günde yaklaşık 87,8 milyon metreküp doğal gaza ulaştı. +\n\nCorpus Christi, Louisiana’daki Sabine Pass’in ardından ABD’nin ikinci en büyük LNG tesisi oldu.\n\nAynı sahada iki sıvılaştırma hattının daha inşaatı sürüyor. Bu hatların 2028’de devreye girmesi ve günlük nominal kapasiteye yaklaşık 11,3 milyon metreküp eklemesi bekleniyor.","contentHash":"2cda4f5c4c8dd5c1d7158b55b55fee726cefa57208816eb1b89a2c3ad5b80426","headline":"Corpus Christi LNG terminalinde üçüncü aşama tamamlandı","language":"tr","primaryCategory":"enerji-piyasalari","publicationStatus":"PUBLISHED","publishedAt":"2026-10-20T10:08:05.522821Z","retractedAt":null,"revisionId":"45dec079-cdfe-4dd4-99d8-7b0e376e805a","revisionNumber":1,"revisionType":"INITIAL","schemaVersion":1,"slug":"corpus-christi-lng-terminalinde-ucuncu-asama-tamamlandi","sources":[{"publishedAt":"2026-09-15T14:00:00.000000Z","role":"PRIMARY","sourceName":"U.S. EIA - Today in Energy","title":"Corpus Christi LNG expansion makes facility the second-largest in the United States","url":"https://www.eia.gov/todayinenergy/detail.php?id=68144"}],"standfirst":"Teksas’taki terminalin genişleme projesi yedi sıvılaştırma hattından oluşuyor. Aynı sahada iki hat daha inşa ediliyor.","storyId":"88de0092-8432-4bf4-86a7-d736ee1ac272","updatedAt":"2026-10-20T10:08:05.522821Z"}
