{"bodyMarkdown":"ABD’nin New England bölgesinde rüzgârdan aylık elektrik üretimi, 2026’nın ilk dokuz ayında geçen yılın aynı dönemine göre ortalama yüzde 68 arttı. EIA, artışı bölgedeki yeni kapasitenin devreye girmesine bağlıyor.\n\nBölgenin rüzgâr enerjisi kapasitesi, 2025’teki yüzde 12’lik artışın ardından 2026’da yüzde 47 artarak 2,5 gigavata çıktı.\n\nEylülde üretim 668,9 gigavatsaatle yılın en yüksek aylık düzeyine ulaştı. Bu miktar, Eylül 2025’teki üretimin iki katından fazla, mart ayındaki önceki zirvenin ise yaklaşık yüzde 10 üzerindeydi.\n\nİlk dokuz aydaki toplam üretim 4.619 gigavatsaat oldu. Böylece 2025’in tamamındaki 4.533 gigavatsaatlik üretim yüzde 1,9 aşıldı.","contentHash":"482e7a5b54a5f8b44beb58d840871cc9bfd31838386e3a7cb22f0e7f4b970ee8","headline":"New England’da rüzgârdan elektrik üretimi arttı","language":"tr","primaryCategory":"enerji-piyasalari","publicationStatus":"PUBLISHED","publishedAt":"2026-10-20T09:32:56.020022Z","retractedAt":null,"revisionId":"afcf55f0-d42a-4d39-a185-450ba059a728","revisionNumber":1,"revisionType":"INITIAL","schemaVersion":1,"slug":"haber-aa080d3c-020e-4056-9641-72e8dd61f9cf","sources":[{"publishedAt":"2026-10-14T14:00:00.000000Z","role":"PRIMARY","sourceName":"U.S. EIA - Today in Energy","title":"Monthly wind generation in ISO-NE is about 68% higher than last year","url":"https://www.eia.gov/todayinenergy/detail.php?id=68304"}],"standfirst":"Bölgede eylül üretimi 668,9 gigavatsaate ulaştı. Bu miktar, geçen yılın aynı ayındaki üretimin iki katını aştı.","storyId":"e5acd1f8-0ffb-4afc-b6f3-7ce61c89db82","updatedAt":"2026-10-20T09:32:56.020022Z"}
