{"bodyMarkdown":"Bu haber geri çekilmiştir.","contentHash":"962dd8df25baab58fbb491b60e98966dab7871dd0f0c29362722fd78efcf73b2","headline":"Haber geri çekildi","language":"tr","primaryCategory":"enerji-piyasalari","publicationStatus":"RETRACTED","publishedAt":"2026-10-26T12:36:18.957495Z","retractedAt":"2026-10-26T12:41:05.468762Z","revisionId":"c6cb3c14-c0e0-4685-9a22-05298d3cd807","revisionNumber":2,"revisionType":"RETRACTION","schemaVersion":1,"slug":"osman-gazi-yuzer-uretim-platformu-karadenizde-gorevine-basladi","sources":[{"publishedAt":null,"role":"PRIMARY","sourceName":"TPAO","title":"Osman Gazi Karadeniz'deki Görev Yerine Uğurlandı","url":"https://www.tpao.gov.tr/haberler/osman-gazi-karadenizdeki-gorev-yerine-ugurlandi"}],"standfirst":null,"storyId":"3731928e-c9ac-4d93-b1ab-1c7cd5410906","updatedAt":"2026-10-26T12:41:05.468762Z"}
