{"bodyMarkdown":"ABD Enerji Bilgi İdaresi’nin (EIA) 2 Ekim 2026 tarihli değerlendirmesine göre, ülkede kuyu başındaki toplam doğal gaz çıkarımı Temmuz 2026’da günlük 137 milyar fitküple rekor seviyeye ulaştı.\nEIA, artışta Texas ve New Mexico’da devreye giren yeni kuyuların belirleyici olduğunu bildiriyor.\nHaberde kullanılan “toplam çıkarım”, kuyu başında çıkarılan gazın tamamını ifade ediyor. Bu ölçüm, tüketici kullanımına uygun kuru gaz üretimiyle aynı değil; günlük 137 milyar fitküplük değer kuru gaz miktarı olarak değerlendirilmemeli.","contentHash":"46c34c96d64a738dbd6d6d3770dcaf9ff29bd6c51185a728fb08e09f450c52fb","headline":"ABD’de doğal gaz çıkarımı Temmuz 2026’da rekor seviyeye ulaştı","language":"tr","primaryCategory":"enerji-piyasalari","publicationStatus":"PUBLISHED","publishedAt":"2026-10-13T08:18:26.620635Z","retractedAt":null,"revisionId":"3dee1118-da21-4200-b49b-dc295422fa68","revisionNumber":1,"revisionType":"INITIAL","schemaVersion":1,"slug":"abd-dogal-gaz-cikarimi-temmuz-2026-rekor","sources":[{"publishedAt":"2026-10-02T14:00:00.000000Z","role":"PRIMARY","sourceName":"U.S. EIA - Today in Energy","title":"U.S. natural gas production reached a record high in July 2026","url":"https://www.eia.gov/todayinenergy/detail.php?id=68225"}],"standfirst":"ABD Enerji Bilgi İdaresi (EIA), kuyu başındaki toplam doğal gaz çıkarımının Temmuz 2026’da günlük 137 milyar fitküpe ulaştığını açıkladı. Kurum, rekorun başlıca nedenini Texas ve New Mexico’da yeni kuyuların devreye girmesi olarak gösteriyor.","storyId":"ea62dd3e-2f7f-40e6-8feb-de0d61cc973b","updatedAt":"2026-10-13T08:18:26.620635Z"}
