{"bodyMarkdown":"Ulaştırma ve Altyapı Bakanı Abdulkadir Uraloğlu, İstanbul Havalimanı’nda 18 Eylül 2026’da açılan 4. pistten 15 Ekim 2026’ya kadar toplam 1.738 kalkış gerçekleştirildiğini bildirdi.\n\nBu kalkışların 1.475’inde standart aletli rotalar (BARPE, IVGUS, VICEN, RATVU) kullanıldı ve toplam 22.453 deniz mili rota kısaltması sağlandı.\n\nRota kısaltması uçuş başına ortalama 15,2 deniz miline denk gelerek yaklaşık 284 ton yakıt tasarrufu ve 897 ton karbondioksit emisyonu azaltımı sağladı.\n\nYeni pist, aynı dönemde havalimanının toplam 22.118 kalkışının %7,9’una tekabül ederek doğu yönünde alternatif bir kalkış imkânı sunuyor.","contentHash":"78b81500e05ed2b7bcae5c7854013ed31a9d7bdcc2c0f11af36959eb283c8538","headline":"İstanbul Havalimanı’nın 4. pistinden bir ayda 284 ton yakıt tasarrufu sağlandı","language":"tr","primaryCategory":"enerji-piyasalari","publicationStatus":"PUBLISHED","publishedAt":"2026-10-27T11:56:15.023846Z","retractedAt":null,"revisionId":"d221956c-87aa-4426-aa54-c578b5186893","revisionNumber":1,"revisionType":"INITIAL","schemaVersion":1,"slug":"istanbul-havalimaninin-4-pistinden-bir-ayda-284-ton-yakit-tasarrufu-saglandi","sources":[{"publishedAt":null,"role":"PRIMARY","sourceName":"Ulaştırma Bakanlığı","title":"4. PİST İLE 1 AYDA 284 TON YAKIT TASARRUFU","url":"https://www.uab.gov.tr/haberler/4-pist-ile-1-ayda-284-ton-yakit-tasarrufu/"}],"standfirst":"18 Eylül‑15 Ekim 2026 tarihleri arasında yeni pistten 1.738 kalkış yapıldı; rota kısaltması 22.453 deniz mili oldu ve bu, yaklaşık 284 ton yakıt tasarrufu ve 897 ton CO₂ azaltımı anlamına geliyor.","storyId":"c2261b77-89d8-491d-87f5-70f94fb9e865","updatedAt":"2026-10-27T11:56:15.023846Z"}
