{"bodyMarkdown":"Enerji ve Tabii Kaynaklar Bakanı Alparslan Bayraktar, \"Attığımız çeşitlendirme adımlarıyla Türkiye, şubat döneminden itibaren yaşanan büyük krize rağmen, büyük petrol ve arz krizine rağmen herhangi bir sıkıntı yaşamadı\" dedi.\n\nBakan, doğal gaz çeşitlendirmesinin bir parçası olarak LNG kullanımını artırdıklarını ve 2016'dan sonra gazlaştırma kapasitesinin beş katına çıktığını vurguladı.\n\n\"2021‑2026 yılları arasında toplam enerjiye verdiğimiz elektrik ve doğal gaz desteği, yaklaşık 74,9 milyar dolar, 75 milyar dolar\" ifadesiyle, kriz döneminde vatandaşların korunması için mali desteklerin büyüklüğü ortaya konuldu.\n\nBOTAŞ, bu yıl itibariyle 13 farklı ülkeden doğal gaz temin eden bir şirket haline geldi.\n\nAkkuyu Nükleer Santrali için önümüzdeki birkaç hafta içinde nükleer yakıt yüklemesi planlanıyor ve 2027 yılından itibaren sistemde elektrik üretimine başlanacak.\n\n2026 bütçesinde enerji desteklerine 600 milyar liradan fazla ayırındığı bildirildi.","contentHash":"04c9c81aea9833da4de52ce9de720eb779e927564460cecc2dbb036f24ca3c98","headline":"Türkiye, çeşitlendirme adımlarıyla büyük petrol ve gaz krizinde sıkıntı yaşamadı","language":"tr","primaryCategory":"enerji-piyasalari","publicationStatus":"PUBLISHED","publishedAt":"2026-10-27T14:03:45.077075Z","retractedAt":null,"revisionId":"33fb31c1-1ef9-45b6-a18f-c7b39d3204b9","revisionNumber":1,"revisionType":"INITIAL","schemaVersion":1,"slug":"turkiye-cesitlendirme-adimlariyla-buyuk-petrol-ve-gaz-krizinde-sikinti-yasamadi","sources":[{"publishedAt":null,"role":"PRIMARY","sourceName":"Enerji Bakanlığı","title":"Çeşitlendirme Adımlarıyla Türkiye, Arz Krizine Rağmen Herhangi Bir Sıkıntı Yaşamadı","url":"https://enerji.gov.tr/haber-detay?id=31955"}],"standfirst":"Enerji ve Tabii Kaynaklar Bakanı Alparslan Bayraktar, şubat krizine rağmen ülkenin enerji arz güvenliğini koruduğunu, LNG çeşitlendirmesinin kapasitesinin beş katına çıktığını ve 2021‑2026 yılları arasında yaklaşık 75 milyar dolar enerji desteği sağlandığını bildirdi.","storyId":"4a3cae0c-c83e-4ba0-b420-73cfe94e6eda","updatedAt":"2026-10-27T14:03:45.077075Z"}
