{"bodyMarkdown":"ABD rafinerileri 2026 yılında çok yüksek oranlarda çalıştı. Mayıs‑Eylül ayları arasında rafineri kullanım oranı %95’in üzerine çıkarak 1998’den bu yana bu aylarda en yüksek seviyeye ulaştı.\n\nSıkı küresel ürün arzı, özellikle dizel için marjları yükselterek rafinerilerin çalıştırma oranlarını artırdı; bu yılki rafineri faaliyetleri büyük ölçüde sıkı uluslararası distilat yakıt arzından kaynaklandı.\n\n1991’den beri Mayıs‑Eylül dönemindeki ortalama kullanım %92 iken, diğer yedi ayda bu oran %88’dir.\n\nRafineriler, yaz aylarında en yüksek oranlarda çalıştıklarından, mevsimsel bakım öncesi ve distilat talebinin en yüksek olduğu sonbahar‑kış dönemine yönelik stoklarda artış gözlemlenir.\n\nEkim’in ilk üç haftasında rafineri kullanım oranı yaz dönemi zirvesinden geriledi, ancak yine de 2021‑2025 beş yıllık mevsimsel ortalamanın üzerindeydi.","contentHash":"5d169103bef6a9b95c3ebdc32a55a0bdfd54a11fd93eae701bfab3ad1b8832a9","headline":"ABD rafinerileri 2026’da Mayıs‑Eylül döneminde kapasitenin %95’inin üzerinde çalıştı","language":"tr","primaryCategory":"enerji-piyasalari","publicationStatus":"PUBLISHED","publishedAt":"2026-10-27T09:35:22.765838Z","retractedAt":null,"revisionId":"4e2689fe-ea36-4c07-84d7-88632d18799a","revisionNumber":1,"revisionType":"INITIAL","schemaVersion":1,"slug":"abd-rafinerileri-2026da-mayis-eylul-doneminde-kapasitenin-95inin-uzerinde","sources":[{"publishedAt":"2026-10-22T14:00:00.000000Z","role":"PRIMARY","sourceName":"U.S. EIA - Today in Energy","title":"U.S. refineries have been running at very high rates in 2026","url":"https://www.eia.gov/todayinenergy/detail.php?id=68344"}],"standfirst":"2026 yılı boyunca ABD rafinerileri, Mayıs‑Eylül aylarında kapasite kullanım oranını %95’in üzerine çıkararak 1998’den bu yana en yüksek seviyeye ulaştı; bu durum sıkı küresel yakıt arzı ve yüksek dizel marjlarıyla desteklendi.","storyId":"1274efca-26ea-42b9-acbe-11802470388f","updatedAt":"2026-10-27T09:35:22.765838Z"}
