{"bodyMarkdown":"ABD Enerji Bilgi İdaresi (EIA), 7 Ekim 2026 tarihli kış görünümünde, ABD hanelerinin 2026–2027 kışındaki enerji harcamalarının kullanılan yakıta göre farklılaşacağını öngörüyor.\n\nKurum, doğal gazla ısınan hanelerin ortalama enerji harcamasının önceki kışa göre yüzde 9 azalmasını bekliyor. Propan kullanan hanelerde ise ortalama yüzde 3 düşüş tahmin ediliyor.\n\nElektrikle ısınan hanelerin elektrik faturalarının ortalama yüzde 4 artması bekleniyor. Isıtma yağı kullanan hanelerde harcamalar için öngörülen artış yüzde 21.\n\nBu oranlar gerçekleşmiş harcama sonuçlarını değil, EIA'nın kışa ilişkin tahminlerini gösteriyor. Karşılaştırma önceki kışa göre yapılıyor ve ABD hanelerini kapsıyor.\n\nKaynak: [ABD Enerji Bilgi İdaresi (EIA), 7 Ekim 2026](https://www.eia.gov/todayinenergy/detail.php?id=68264).","contentHash":"a16436958b2b9f9bd2b3e6c30d0e409f0ec43f0da1b20555648b2062d2df6a35","headline":"EIA: ABD'de kışın ısınma giderleri yakıta göre farklı seyredebilir","language":"tr","primaryCategory":"enerji-piyasalari","publicationStatus":"PUBLISHED","publishedAt":"2026-10-09T13:26:48.820415Z","retractedAt":null,"revisionId":"e3e753e4-38e3-4e3b-b7e5-08168d3178ab","revisionNumber":1,"revisionType":"INITIAL","schemaVersion":1,"slug":"eia-abd-kis-isinma-giderleri-2026-2027","sources":[{"publishedAt":"2026-10-07T14:00:00.000000Z","role":"PRIMARY","sourceName":"U.S. EIA - Today in Energy","title":"Mixed outlook for energy expenditures this winter","url":"https://www.eia.gov/todayinenergy/detail.php?id=68264"}],"standfirst":"EIA, 2026–2027 kışında doğal gaz ve propanla ısınan ABD hanelerinde harcamaların düşmesini, elektrik ve ısıtma yağı kullananlarda ise artmasını bekliyor.","storyId":"8c3a02a8-6b13-4e5f-8f6c-73fe612bcbd2","updatedAt":"2026-10-09T13:26:48.820415Z"}
