{"bodyMarkdown":"Bu haber geri çekilmiştir.","contentHash":"962dd8df25baab58fbb491b60e98966dab7871dd0f0c29362722fd78efcf73b2","headline":"Haber geri çekildi","language":"tr","primaryCategory":"Enerji","publicationStatus":"RETRACTED","publishedAt":"2026-10-07T08:00:00Z","retractedAt":"2026-10-07T08:00:00Z","revisionId":"00000000-0000-0000-0000-000000000102","revisionNumber":2,"revisionType":"RETRACTION","schemaVersion":1,"slug":"sentetik-1","sources":[{"publishedAt":"2026-10-07T07:00:00Z","role":"PRIMARY","sourceName":"Sentetik Kaynak","title":"Sentetik kaynak başlığı","url":"https://example.test/source-1"}],"standfirst":null,"storyId":"00000000-0000-0000-0000-000000000001","updatedAt":"2026-10-07T08:00:00Z"}
